id,text,retweet_count,reply_count,like_count,quote_count,media_url,media_type,short_url,expanded_url,annotation
676533798876651520,ITSOFLUFFAYYYYY 12/10 https://t.co/bfw13CnuuZ,482,4,1660,0,https://pbs.twimg.com/media/CWOH4s9U8AEtkmQ.jpg,photo,https://t.co/bfw13CnuuZ,https://twitter.com/dog_rates/status/676533798876651520/photo/1,
676496375194980353,Say hello to Griffin. He's upset because his costume for Halloween didn't arrive until today. 9/10 cheer up pup https://t.co/eoBCjSFajX,456,14,1334,1,https://pbs.twimg.com/media/CWNl3S9WcAARN34.jpg,photo,https://t.co/eoBCjSFajX,https://twitter.com/dog_rates/status/676496375194980353/photo/1,Griffin
676470639084101634,Three generations of pupper. 11/10 for all https://t.co/tAmQYvzrau,4086,39,10311,0,https://pbs.twimg.com/media/CWNOdIpWoAAWid2.jpg,photo,https://t.co/tAmQYvzrau,https://twitter.com/dog_rates/status/676470639084101634/photo/1,
676440007570247681,Hope your Monday isn't too awful. Here's two baseball puppers. 11/10 for each https://t.co/dB0H9hdZai,576,12,1527,0,https://pbs.twimg.com/media/CWMyl86WEAAL1PW.jpg,photo,https://t.co/dB0H9hdZai,https://twitter.com/dog_rates/status/676440007570247681/photo/1,
676430933382295552,"Meet Duke. He's an Urban Parmesan. They know he's scared of the green rubber dog. ""Why u do dis?"" thinks Duke. 10/10 https://t.co/3bim9U5Idr",299,10,1226,0,https://pbs.twimg.com/media/CWMqV7WUYAEEClG.jpg,photo,https://t.co/3bim9U5Idr,https://twitter.com/dog_rates/status/676430933382295552/photo/1,Duke
676263575653122048,All this pupper wanted to do was go skiing. No one told him about the El NiÃ±o. Poor pupper. 10/10 maybe next year https://t.co/fTgbq1UBR9,470,22,1836,0,https://pbs.twimg.com/media/CWKSIfUUYAAiOBO.jpg,photo,https://t.co/fTgbq1UBR9,https://twitter.com/dog_rates/status/676263575653122048/photo/1,El NiÃ±o
676237365392908289,Say hello to Winston. He has no respect for the system. Much rebellion. I think that's a palm tree... nice. 8/10 https://t.co/dOLQddhXLZ,240,8,1054,0,https://pbs.twimg.com/media/CWJ6Sc-WwAAlpI6.jpg,photo,https://t.co/dOLQddhXLZ,https://twitter.com/dog_rates/status/676237365392908289/photo/1,Winston
676219687039057920,This is Kenneth. He's stuck in a bubble. 10/10 hang in there Kenneth https://t.co/uQt37xlYMJ,27196,354,69216,520,https://pbs.twimg.com/media/CWJqN9iWwAAg86R.jpg,photo,https://t.co/uQt37xlYMJ,https://twitter.com/dog_rates/status/676219687039057920/photo/1,Kenneth
676215927814406144,This is Herm. He just wants to be like the other dogs. Sneaky tongue slip. Super fuzzy. 9/10 would cuddle firmly https://t.co/tg8h9lzCHv,506,16,1523,0,https://pbs.twimg.com/media/CWJmzNsWUAE706Z.jpg,photo,https://t.co/tg8h9lzCHv,https://twitter.com/dog_rates/status/676215927814406144/photo/1,Herm
676191832485810177,These two pups just met and have instantly bonded. Spectacular scene. Mesmerizing af. 10/10 and 7/10 for blue dog https://t.co/gwryaJO4tC,895,12,1999,0,https://pbs.twimg.com/media/CWJQ4UNWIAAP68a.jpg,photo,https://t.co/gwryaJO4tC,https://twitter.com/dog_rates/status/676191832485810177/photo/1,
676146341966438401,This is Bert. He likes flowers. 10/10 https://t.co/lmQRrNxaQu,573,12,1711,0,https://pbs.twimg.com/media/CWIngp5WEAAJOy3.jpg,photo,https://t.co/lmQRrNxaQu,https://twitter.com/dog_rates/status/676146341966438401/photo/1,Bert
676121918416756736,Here we are witnessing a very excited dog. Clearly has no control over neck movements. 8/10 would still pet https://t.co/ICNIjSkrXs,1006,20,1903,0,,,https://t.co/ICNIjSkrXs,https://vine.co/v/iZXg7VpeDAv,
676101918813499392,Meet Striker. He's ready for Christmas. 11/10 https://t.co/B3xxSLjQSH,1030,13,2525,0,https://pbs.twimg.com/media/CWH_FTgWIAAwOUy.jpg,photo,https://t.co/B3xxSLjQSH,https://twitter.com/dog_rates/status/676101918813499392/photo/1,Striker
676098748976615425,Extremely rare pup here. Very religious. Always praying. Too many legs. Not overwhelmingly fluffy. Won't bark. 3/10 https://t.co/REyE5YKVBb,1221,23,2609,0,https://pbs.twimg.com/media/CWH8L72UkAAvjql.jpg,photo,https://t.co/REyE5YKVBb,https://twitter.com/dog_rates/status/676098748976615425/photo/1,
676089483918516224,"""Yes hello I'ma just snag this here toasted bagel real quick. carry on."" 9/10 https://t.co/Cuz0Osnekp",382,12,1146,0,https://pbs.twimg.com/media/CWHzzFGXIAA0Y_H.jpg,photo,https://t.co/Cuz0Osnekp,https://twitter.com/dog_rates/status/676089483918516224/photo/1,
675898130735476737,I'm sure you've all seen this pupper. Not prepared at all for the flying disc of terror. 10/10 https://t.co/G0pQiFGM7O,494,16,1400,0,https://pbs.twimg.com/media/CWFFt3_XIAArIYK.jpg,photo,https://t.co/G0pQiFGM7O,https://twitter.com/dog_rates/status/675898130735476737/photo/1,
675891555769696257,This is Donny. He's summoning the demon monster Babadook. 6/10 Donny please no that won't be a good time for anyone https://t.co/kiW6Knb7Gp,743,26,1869,0,https://pbs.twimg.com/media/CWE_x33UwAEE3no.jpg,photo,https://t.co/kiW6Knb7Gp,https://twitter.com/dog_rates/status/675891555769696257/photo/1,Donny
675888385639251968,Breathtaking scene. A father taking care of his newborn pup. Tugs at the heartstrings. 10/10 restores my faith https://t.co/06oZdehGEa,819,17,2064,0,https://pbs.twimg.com/media/CWE85snWIAEG5ES.jpg,photo,https://t.co/06oZdehGEa,https://twitter.com/dog_rates/status/675888385639251968/photo/1,
675878199931371520,"Ok, I'll admit this is a pretty adorable bunny hopping towards the ocean but please only send in dogs... 11/10 https://t.co/sfsVCGIipI",1216,26,3672,1,https://pbs.twimg.com/media/CWEzo19WoAEiOCj.jpg,photo,https://t.co/sfsVCGIipI,https://twitter.com/dog_rates/status/675878199931371520/photo/1,
675870721063669760,&amp; this is Yoshi. Another world record contender 11/10 (what the hell is happening why are there so many contenders?) https://t.co/QG708dDNH6,484,25,1425,0,https://pbs.twimg.com/media/CWEs1b-WEAEhq82.jpg,photo,https://t.co/QG708dDNH6,https://twitter.com/dog_rates/status/675870721063669760/photo/1,Yoshi
675853064436391936,Here we have an entire platoon of puppers. Total score: 88/80 would pet all at once https://t.co/y93p6FLvVw,1110,15,2364,1,https://pbs.twimg.com/media/CWEcxqWVEAAHyGH.jpg,photo,https://t.co/y93p6FLvVw,https://twitter.com/dog_rates/status/675853064436391936/photo/1,
675849018447167488,This dog is being demoted to a 9/10 for not wearing a helmet while riding. Gotta stay safe out there. Thank you,122,12,839,0,,,,,
675845657354215424,"This is Pepper. She's not fully comfortable riding her imaginary bike yet. 10/10 don't worry pupper, it gets easier https://t.co/40dj4eTsXG",760,15,1991,0,https://pbs.twimg.com/media/CWEWClfW4AAnqhG.jpg,photo,https://t.co/40dj4eTsXG,https://twitter.com/dog_rates/status/675845657354215424/photo/1,Pepper
675822767435051008,ðŸŽ¶ HELLO FROM THE OTHER SIIIIIIIIDE ðŸŽ¶ 10/10s https://t.co/GK2HJtkdQk,467,14,1345,0,https://pbs.twimg.com/media/CWEBOFYWwAA-O2c.jpg,photo,https://t.co/GK2HJtkdQk,https://twitter.com/dog_rates/status/675822767435051008/photo/1,
675820929667219457,Here's a handful of sleepy puppers. All look unaware of their surroundings. Lousy guard dogs. Still cute tho 11/10s https://t.co/lyXX3v5j4s,199,6,931,0,https://pbs.twimg.com/media/CWD_jQMWEAAdYwH.jpg,photo,https://t.co/lyXX3v5j4s,https://twitter.com/dog_rates/status/675820929667219457/photo/1,
675798442703122432,This is Bernie. He just touched a boob for the first time. 10/10 https://t.co/whQKMygnK6,2989,74,9090,118,https://pbs.twimg.com/media/CWDrGH4UYAARoq_.jpg,photo,https://t.co/whQKMygnK6,https://twitter.com/dog_rates/status/675798442703122432/photo/1,Bernie
675781562965868544,Say hello to Buddah. He was Waldo for Halloween. 11/10 https://t.co/DVAqAnb624,412,10,1416,0,https://pbs.twimg.com/media/CWDbv2yU4AARfeH.jpg,photo,https://t.co/DVAqAnb624,https://twitter.com/dog_rates/status/675781562965868544/photo/1,Buddah
675740360753160193,Here's a pupper licking in slow motion. 12/10 please enjoy https://t.co/AUJi8ujxw9,288,9,1031,0,,,https://t.co/AUJi8ujxw9,https://twitter.com/dog_rates/status/675740360753160193/video/1,
675710890956750848,This is Lenny. He was just told that he couldn't explore the fish tank. 12/10 smh all that work for nothing https://t.co/JWi6YrpiO1,704,12,1634,0,https://pbs.twimg.com/media/CWCbd8CWwAA6VxC.jpg,photo,https://t.co/JWi6YrpiO1,https://twitter.com/dog_rates/status/675710890956750848/photo/1,Lenny
675707330206547968,We've got ourselves a battle here. Watch out Reggie. 11/10 https://t.co/ALJvbtcwf0,586,13,1745,0,https://pbs.twimg.com/media/CWCYOqWUAAARmGr.jpg,photo,https://t.co/ALJvbtcwf0,https://twitter.com/dog_rates/status/675707330206547968/photo/1,Reggie
675706639471788032,This is a Sizzlin Menorah spaniel from Brooklyn named Wylie. Lovable eyes. Chiller as hell. 10/10 and I'm out.. poof https://t.co/7E0AiJXPmI,82,2,562,0,https://pbs.twimg.com/media/CWCXj35VEAIFvtk.jpg,photo,https://t.co/7E0AiJXPmI,https://twitter.com/dog_rates/status/675706639471788032/photo/1,Sizzlin Menorah spaniel
675534494439489536,Seriously guys?! Only send in dogs. I only rate dogs. This is a baby black bear... 11/10 https://t.co/H7kpabTfLj,348,14,1618,1,https://pbs.twimg.com/media/CV_7CV6XIAEV05u.jpg,photo,https://t.co/H7kpabTfLj,https://twitter.com/dog_rates/status/675534494439489536/photo/1,
675531475945709568,This is Ellie AKA Queen Slayer of the Orbs. Very self-motivated. Great yard. Rad foliage. 10/10 would pet diligently https://t.co/c9jmg3Xtzn,319,7,1038,0,https://pbs.twimg.com/media/CV_4ShmUYAA3wNu.jpg,photo,https://t.co/c9jmg3Xtzn,https://twitter.com/dog_rates/status/675531475945709568/photo/1,Ellie
675522403582218240,Meet Sammy. He's a Motorola Firefox. Hat under hoodie (must be a half-decent up and coming white rapper) 10/10 https://t.co/rO2zxf0OQ0,244,4,909,0,https://pbs.twimg.com/media/CV_wCh8W4AEWWZ9.jpg,photo,https://t.co/rO2zxf0OQ0,https://twitter.com/dog_rates/status/675522403582218240/photo/1,Sammy
675517828909424640,12/10 stay woke https://t.co/XDiQw4Akiw,398,4,1114,0,https://pbs.twimg.com/media/CV_r3v4VAAALvwg.jpg,photo,https://t.co/XDiQw4Akiw,https://twitter.com/dog_rates/status/675517828909424640/photo/1,
675501075957489664,"I shall call him squishy and he shall be mine, and he shall be my squishy. 13/10 https://t.co/WId5lxNdPH",5100,211,15107,221,https://pbs.twimg.com/media/CV_cnjHWUAADc-c.jpg,photo,https://t.co/WId5lxNdPH,https://twitter.com/dog_rates/status/675501075957489664/photo/1,
675497103322386432,Meet Reggie. He's going for the world record. Must concentrate. Focus up pup. 11/10 we all believe in you Reggie https://t.co/h3AWz4AzuC,1105,22,2743,0,https://pbs.twimg.com/media/CV_ZAhcUkAUeKtZ.jpg,photo,https://t.co/h3AWz4AzuC,https://twitter.com/dog_rates/status/675497103322386432/photo/1,Reggie
675489971617296384,RT until we find this dog. Clearly a cool dog (front leg relaxed out window). Looks to be a superb driver. 10/10 https://t.co/MnTrKaQ8Wn,523,9,1118,0,https://pbs.twimg.com/media/CV_SimUWoAAvJSY.jpg,photo,https://t.co/MnTrKaQ8Wn,https://twitter.com/dog_rates/status/675489971617296384/photo/1,
675483430902214656,Rare shielded battle dog here. Very happy about abundance of lettuce. Painfully slow fetcher. Still petable. 5/10 https://t.co/C3tlKVq7eO,829,14,1613,0,https://pbs.twimg.com/media/CV_MmGZU8AAggM6.jpg,photo,https://t.co/C3tlKVq7eO,https://twitter.com/dog_rates/status/675483430902214656/photo/1,
675432746517426176,Happy Friday. Here's some golden puppers. 12/10 for all https://t.co/wNkqAED6lG,493,7,1331,0,https://pbs.twimg.com/media/CV-ef64WoAAbh0I.jpg,photo,https://t.co/wNkqAED6lG,https://twitter.com/dog_rates/status/675432746517426176/photo/1,
675372240448454658,"The tail alone is 13/10. Great dog, better owner https://t.co/IyAXinfyju",445,7,1491,1,https://pbs.twimg.com/media/CV9nd30XAAAEba5.jpg,photo,https://t.co/IyAXinfyju,https://twitter.com/dog_rates/status/675372240448454658/photo/1,
675362609739206656,This is Daisy. She loves that shoe. Still no seat belt. Super churlish. 12/10 the dogs are killing it today https://t.co/cZlkvgRPdn,187,2,916,0,https://pbs.twimg.com/media/CV9etctWUAAl5Hp.jpg,photo,https://t.co/cZlkvgRPdn,https://twitter.com/dog_rates/status/675362609739206656/photo/1,Daisy
675354435921575936,Everyone needs to watch this. 13/10 https://t.co/Bb3xnpsWBC,14628,520,28906,197,,,https://t.co/Bb3xnpsWBC,https://twitter.com/dog_rates/status/675354435921575936/video/1,
675349384339542016,Yea I lied. Here's more. All 13/10 https://t.co/ZQZf2U4xCP,1957,75,3444,0,https://pbs.twimg.com/media/CV9Sq__UsAApxZY.jpg,photo,https://t.co/ZQZf2U4xCP,https://twitter.com/dog_rates/status/675349384339542016/photo/1,
675334060156301312,Good morning here's a grass pupper. 12/10 https://t.co/2d68FmWGGs,1106,12,2418,1,https://pbs.twimg.com/media/CV9EvZKUAAA3_X3.jpg,photo,https://t.co/2d68FmWGGs,https://twitter.com/dog_rates/status/675334060156301312/photo/1,
675166823650848770,This is Arnold. He broke his leg saving a handicapped child from a forest fire. True hero. 10/10 inspirational dog https://t.co/bijCeHeX4C,1350,41,3095,0,https://pbs.twimg.com/media/CV6spB7XAAIpMyP.jpg,photo,https://t.co/bijCeHeX4C,https://twitter.com/dog_rates/status/675166823650848770/photo/1,Arnold
675153376133427200,What kind of person sends in a picture without a dog in it? 1/10 just because that's a nice table https://t.co/RDXCfk8hK0,2217,42,5455,4,https://pbs.twimg.com/media/CV6gaUUWEAAnETq.jpg,photo,https://t.co/RDXCfk8hK0,https://twitter.com/dog_rates/status/675153376133427200/photo/1,
675149409102012420,holy shit 12/10 https://t.co/p6O8X93bTQ,1469,39,3269,0,https://pbs.twimg.com/media/CV6czeEWEAEdChp.jpg,photo,https://t.co/p6O8X93bTQ,https://twitter.com/dog_rates/status/675149409102012420/photo/1,
675147105808306176,When you're presenting a group project and the 4th guy tells the teacher that he did all the work. 10/10 https://t.co/f50mbB4UWS,193,7,826,0,https://pbs.twimg.com/media/CV6atgoWcAEsdv6.jpg,photo,https://t.co/f50mbB4UWS,https://twitter.com/dog_rates/status/675147105808306176/photo/1,
675146535592706048,This is Coops. He's yelling at the carpet. Not very productive Coops. 7/10 https://t.co/Uz52oYnHzF,249,3,1036,0,https://pbs.twimg.com/media/CV6aMToXIAA7kH4.jpg,photo,https://t.co/Uz52oYnHzF,https://twitter.com/dog_rates/status/675146535592706048/photo/1,Coops
675145476954566656,What an honor. 3 dogs here. Blond one is clearly a gymnast. Other two just confused. Very nifty pups. 9/10 for all https://t.co/YDgstgIDGs,762,12,1868,0,https://pbs.twimg.com/media/CV6ZOPqWsAA20Uj.jpg,photo,https://t.co/YDgstgIDGs,https://twitter.com/dog_rates/status/675145476954566656/photo/1,
675135153782571009,This is Steven. He got locked outside. Damn it Steven. 5/10 nice grill tho https://t.co/zf7Sxxjfp3,403,12,1134,0,https://pbs.twimg.com/media/CV6P1lnWIAAUQHk.jpg,photo,https://t.co/zf7Sxxjfp3,https://twitter.com/dog_rates/status/675135153782571009/photo/1,Steven
675113801096802304,Meet Zuzu. He just graduated college. Astute pupper. Needs 2 leashes to contain him. Wasn't ready for the pic. 10/10 https://t.co/2H5SKmk0k7,675,16,1693,0,https://pbs.twimg.com/media/CV58a4nXAAApywo.jpg,photo,https://t.co/2H5SKmk0k7,https://twitter.com/dog_rates/status/675113801096802304/photo/1,Zuzu
675111688094527488,Say hello to Oliver. He thought what was inside the pillow should be outside the pillow. Blurry since birth. 8/10 https://t.co/lFU9W31Fg9,209,5,843,0,https://pbs.twimg.com/media/CV56f54WsAEv4kJ.jpg,photo,https://t.co/lFU9W31Fg9,https://twitter.com/dog_rates/status/675111688094527488/photo/1,Oliver
675109292475830276,C'mon guys. We've been over this. We only rate dogs. This is a cow. Please only submit dogs. Thank you...... 9/10 https://t.co/WjcELNEqN2,979,21,2452,0,https://pbs.twimg.com/media/CV54UQTXAAAGf-j.jpg,photo,https://t.co/WjcELNEqN2,https://twitter.com/dog_rates/status/675109292475830276/photo/1,
675047298674663426,This is a fluffy albino Bacardi Columbia mix. Excellent at the tweets. 11/10 would hug gently https://t.co/diboDRUuEI,268,10,906,0,https://pbs.twimg.com/media/CV4_8FgXAAQOj4S.jpg,photo,https://t.co/diboDRUuEI,https://twitter.com/dog_rates/status/675047298674663426/photo/1,Bacardi Columbia
675015141583413248,Meet Moe. He's a golden Fetty Woof. Doesn't respect the authorities. Might own a motorhome? 10/10 revolutionary pup https://t.co/JAncIdNp8G,1007,34,2352,0,https://pbs.twimg.com/media/CV4iqh5WcAEV1E6.jpg,photo,https://t.co/JAncIdNp8G,https://twitter.com/dog_rates/status/675015141583413248/photo/1,Moe
675006312288268288,Say hello to Mollie. This pic was taken after she bet all her toys on Ronda Rousey. 10/10 hang in there pupper https://t.co/QMmAqA9VqO,194,8,850,0,https://pbs.twimg.com/media/CV4aqCwWsAIi3OP.jpg,photo,https://t.co/QMmAqA9VqO,https://twitter.com/dog_rates/status/675006312288268288/photo/1,Mollie
675003128568291329,Meet Laela. She's adorable. Magnificent eyes. But I don't see a seat belt. Insubordinate.. and churlish. Still 12/10 https://t.co/pCGDgLkLo6,395,9,1352,0,https://pbs.twimg.com/media/CV4XwYiWoAAHQIF.jpg,photo,https://t.co/pCGDgLkLo6,https://twitter.com/dog_rates/status/675003128568291329/photo/1,Laela
674999807681908736,Ok last one of these. I may try to make some myself. Anyway here ya go. 13/10 https://t.co/i9CDd1oEu8,934,26,1934,0,https://pbs.twimg.com/media/CV4UvgNUkAEEnZd.jpg,photo,https://t.co/i9CDd1oEu8,https://twitter.com/dog_rates/status/674999807681908736/photo/1,
674805413498527744,"When your entire life is crumbling before you and you're trying really hard to hold your shit together.
10/10 https://t.co/vqFkgYPCW8",304,9,733,0,,,https://t.co/vqFkgYPCW8,https://twitter.com/dog_rates/status/674805413498527744/video/1,
674800520222154752,This is Tedders. He broke his leg saving babies from the Pompeii eruption. 11/10 where's his Purple Heart? @POTUS https://t.co/cMI2AcLm4B,732,21,2625,0,https://pbs.twimg.com/media/CV1ffl3XAAAiFyr.jpg,photo,https://t.co/cMI2AcLm4B,https://twitter.com/dog_rates/status/674800520222154752/photo/1,Tedders
674793399141146624,I have found another. 13/10 https://t.co/HwroPYv8pY,929,34,2157,0,https://pbs.twimg.com/media/CV1ZA3oWEAA1HW_.jpg,photo,https://t.co/HwroPYv8pY,https://twitter.com/dog_rates/status/674793399141146624/photo/1,
674790488185167872,ER... MER... GERD 13/10 https://t.co/L1puJISV1a,213,4,960,0,https://pbs.twimg.com/media/CV1WXsmWcAAgQ56.jpg,photo,https://t.co/L1puJISV1a,https://twitter.com/dog_rates/status/674790488185167872/photo/1,
674788554665512960,Say hello to Maggie. She's a Western Septic Downy. Pretends to be Mexican. Great hardwood flooring. 9/10 https://t.co/P3ElQ2wsjb,180,8,703,0,https://pbs.twimg.com/media/CV1Um8vWIAAmhQn.jpg,photo,https://t.co/P3ElQ2wsjb,https://twitter.com/dog_rates/status/674788554665512960/photo/1,Maggie
674781762103414784,Bedazzled pup here. Fashionable af. Super yellow. Looks hella fluffy. Webbed paws for efficient fetching. 8/10 https://t.co/ot8yMUGodj,1013,20,1749,0,https://pbs.twimg.com/media/CV1ObvEWcAA7c6i.jpg,photo,https://t.co/ot8yMUGodj,https://twitter.com/dog_rates/status/674781762103414784/photo/1,
674774481756377088,This is Superpup. His head isn't proportional to his body. Has yet to serve any justice. 11/10 maybe one day pupper https://t.co/gxIFgg8ktm,397,5,958,0,https://pbs.twimg.com/media/CV1HztsWoAAuZwo.jpg,photo,https://t.co/gxIFgg8ktm,https://twitter.com/dog_rates/status/674774481756377088/photo/1,Superpup
674767892831932416,This pup was carefully tossed to make it look like she's riding that horse. I have no words this is fabulous. 12/10 https://t.co/Bob33W4sfD,679,9,1586,0,https://pbs.twimg.com/media/CV1B0WkWwAEBKVx.jpg,photo,https://t.co/Bob33W4sfD,https://twitter.com/dog_rates/status/674767892831932416/photo/1,
674764817387900928,These two pups are masters of camouflage. Very dedicated to the craft. Both must've spent decades practicing. 10/10s https://t.co/RBiQ8hPqwr,197,5,681,0,https://pbs.twimg.com/media/CV0_BQ2W4AAYBzH.jpg,photo,https://t.co/RBiQ8hPqwr,https://twitter.com/dog_rates/status/674764817387900928/photo/1,
674754018082705410,Just received another perfect photo of dogs and the sunset. 12/10 https://t.co/9YmNcxA2Cc,374,11,1198,0,https://pbs.twimg.com/media/CV01M3ZWIAAV7rv.jpg,photo,https://t.co/9YmNcxA2Cc,https://twitter.com/dog_rates/status/674754018082705410/photo/1,
674752233200820224,Everyone please just appreciate how perfect these two photos are. 12/10 for both https://t.co/rLf7asnHxO,388,4,1271,0,https://pbs.twimg.com/media/CV0zkzEUwAAMNN4.jpg,photo,https://t.co/rLf7asnHxO,https://twitter.com/dog_rates/status/674752233200820224/photo/1,
674743008475090944,This is Sophie. She just saw a spider. 10/10 don't just stand there Sophie https://t.co/VagYftZccT,452,12,1227,0,https://pbs.twimg.com/media/CV0rL7RWEAAbhqm.jpg,photo,https://t.co/VagYftZccT,https://twitter.com/dog_rates/status/674743008475090944/photo/1,Sophie
674742531037511680,Some clarification is required. The dog is singing Cher and that is more than worthy of an 11/10. Thank you,42,2,420,0,,,,,Cher
674739953134403584,"""ðŸŽ¶ DO YOU BELIEVE IN LIFE AFTER LOVE ðŸŽ¶""
11/10 https://t.co/URNs5zFskc",320,14,944,0,https://pbs.twimg.com/media/CV0oaHFW4AA9Coi.jpg,photo,https://t.co/URNs5zFskc,https://twitter.com/dog_rates/status/674739953134403584/photo/1,
674737130913071104,Meet Rufio. He is unaware of the pink legless pupper wrapped around him. Might want to get that checked 10/10 &amp; 4/10 https://t.co/KNfLnYPmYh,79,8,562,0,https://pbs.twimg.com/media/CV0l10AU8AAfg-a.jpg,photo,https://t.co/KNfLnYPmYh,https://twitter.com/dog_rates/status/674737130913071104/photo/1,Rufio
674690135443775488,Meet Patrick. He's an exotic pup. Jumps great distances for a dog. Always gets injured when I toss him a ball. 3/10 https://t.co/Unz1uNrOzo,404,21,1002,0,https://pbs.twimg.com/media/CVz7FxXWUAAlTRP.jpg,photo,https://t.co/Unz1uNrOzo,https://twitter.com/dog_rates/status/674690135443775488/photo/1,Patrick
674670581682434048,Meet Jeb &amp; Bush. Jeb is somehow stuck in that fence and Bush won't stop whispering sweet nothings in his ear. 9/10s https://t.co/NRNExUy9Hm,554,13,1411,0,https://pbs.twimg.com/media/CVzpUGUWUAAo7Vn.jpg,photo,https://t.co/NRNExUy9Hm,https://twitter.com/dog_rates/status/674670581682434048/photo/1,Jeb
674664755118911488,This is Rodman. He's getting destroyed by the surfs. Valiant effort though. 10/10 better than most puppers probably https://t.co/S8wCLemrNb,200,5,794,0,https://pbs.twimg.com/media/CVzkA7-WsAAcXz6.jpg,photo,https://t.co/S8wCLemrNb,https://twitter.com/dog_rates/status/674664755118911488/photo/1,Rodman
674646392044941312,Two gorgeous dogs here. Little waddling dog is a rebel. Refuses to look at camera. Must be a preteen. 5/10 &amp; 8/10 https://t.co/YPfw7oahbD,418,8,1230,0,https://pbs.twimg.com/media/CVzTUGrW4AAirJH.jpg,photo,https://t.co/YPfw7oahbD,https://twitter.com/dog_rates/status/674646392044941312/photo/1,
674644256330530816,When you see sophomores in high school driving. 11/10 https://t.co/m6aC8d1Kzp,235,12,903,0,https://pbs.twimg.com/media/CVzRXmXWIAA0Fkr.jpg,photo,https://t.co/m6aC8d1Kzp,https://twitter.com/dog_rates/status/674644256330530816/photo/1,
674638615994089473,This pupper is fed up with being tickled. 12/10 I'm currently working on an elaborate heist to steal this dog https://t.co/F33n1hy3LL,499,10,1480,0,https://pbs.twimg.com/media/CVzMPh1UsAELQ_p.jpg,photo,https://t.co/F33n1hy3LL,https://twitter.com/dog_rates/status/674638615994089473/photo/1,
674632714662858753,Rare submerged pup here. Holds breath for a long time. Frowning because that spoon ignores him. 5/10 would still pet https://t.co/EJzzNHE8bE,491,7,1313,0,https://pbs.twimg.com/media/CVzG3yOVAAAqi9I.jpg,photo,https://t.co/EJzzNHE8bE,https://twitter.com/dog_rates/status/674632714662858753/photo/1,
674606911342424069,The 13/10 also takes into account this impeccable yard. Louis is great but the future dad in me can't ignore that luscious green grass,85,2,826,0,,,,,Louis
674468880899788800,This is Louis. He thinks he's flying. 13/10 this is a legendary pup https://t.co/6d9WziPXmx,1753,31,5447,1,https://pbs.twimg.com/media/CVwx3dNWsAAdo4G.jpg,photo,https://t.co/6d9WziPXmx,https://twitter.com/dog_rates/status/674468880899788800/photo/1,Louis
674447403907457024,This pupper just wants a belly rub. This pupper has nothing to do w the tree being sideways now. 10/10 good pupper https://t.co/AyJ7Ohk71f,306,8,931,0,https://pbs.twimg.com/media/CVweVUfW4AACPwI.jpg,photo,https://t.co/AyJ7Ohk71f,https://twitter.com/dog_rates/status/674447403907457024/photo/1,
674436901579923456,Meet Bailey. She plays with her food. Very childish. Doesn't even need a battle helmet smh. Still cute though. 9/10 https://t.co/CLEOjxhTEx,336,10,958,0,https://pbs.twimg.com/media/CVwUyM9WwAAGDjv.jpg,photo,https://t.co/CLEOjxhTEx,https://twitter.com/dog_rates/status/674436901579923456/photo/1,Bailey
674422304705744896,This is Ava. She doesn't understand flowers. 12/10 would caress firmly https://t.co/BxTJAFSIgk,452,12,1248,0,https://pbs.twimg.com/media/CVwHgblWcAACWOD.jpg,photo,https://t.co/BxTJAFSIgk,https://twitter.com/dog_rates/status/674422304705744896/photo/1,Ava
674416750885273600,This is Jonah. He's a Stinted Fisher Price. Enjoys chewing on his miniature RipStik. 10/10 very upbeat fellow https://t.co/7qjXy1uUYY,113,7,587,0,https://pbs.twimg.com/media/CVwCdCFW4AUHY4D.jpg,photo,https://t.co/7qjXy1uUYY,https://twitter.com/dog_rates/status/674416750885273600/photo/1,Jonah
674410619106390016,This is Lenny. He wants to be a sprinkler. 10/10 you got this Lenny https://t.co/CZ0YaB40Hn,389,6,1038,0,https://pbs.twimg.com/media/CVv84VDUEAEm3dW.jpg,photo,https://t.co/CZ0YaB40Hn,https://twitter.com/dog_rates/status/674410619106390016/photo/1,Lenny
674394782723014656,This is Gary. He's a hide and seek champion. Second only to Kony. 8/10 Gary has a gift https://t.co/cAlB4XCcsi,479,15,1297,3,https://pbs.twimg.com/media/CVvueeeWwAUcQLR.jpg,photo,https://t.co/cAlB4XCcsi,https://twitter.com/dog_rates/status/674394782723014656/photo/1,Gary
